Product Name,Original Price,Discounted Price,Rating,Reviews
Informa Clair Lampu Meja Multifungsi - Hitam,Rp299.000,Rp179.000,,
Odi Meja Lipat Laptop Dengan Tempat Gelas - Biru Muda,Rp99.900,,,
Informa Topaz Meja Tamu Dengan Penyimpanan - Hitam,Rp189.000,Rp99.000,,
Informa Toby Meja Tamu Dengan Penyimpanan - Hitam,Rp189.000,Rp89.000,,
Informa Toby Meja Tamu Dengan Penyimpanan - Putih,Rp189.000,Rp89.000,,
Soleil Kursi Lipat - Hitam,Rp219.900,Rp119.900,,
Informa Neo Dacey Kursi Kafe - Putih,Rp659.000,Rp239.000,,
Informa Colorado Set Kursi & Meja Teras - Cokelat,Rp999.000,Rp649.000,,
Odi Meja Lipat Laptop Dengan Mouse Pad - Hitam,Rp199.000,,,
Krisbow Meja Lipat Adjustable - Putih,Rp399.900,Rp249.900,,
Krisbow 122x62 Cm Meja Lipat - Putih,Rp649.000,Rp584.100,,
Informa Rak Troli Penyimpanan 4 Tingkat 38x26x86 Cm,Rp299.000,Rp129.000,,
Soleil Meja Teras Dengan Tray - Hitam,Rp299.000,Rp129.900,,
Informa Neo Helios Meja Sisi - Hitam,Rp299.000,Rp139.000,,
Soleil Meja Teras Sisi 45 Cm - Hitam,Rp249.900,Rp224.910,,
Soleil Bangku Metal - Hitam,Rp109.900,Rp79.900,,
Soleil Kursi Lipat - Putih,Rp219.900,Rp119.900,,
Informa Yaris Kursi Anak - Biru Tua,Rp159.000,Rp115.000,,
Soleil 60 Cm Meja Teras Round - Hitam,Rp329.900,Rp296.910,,
Soleil Kursi Teras Rotan - Cokelat Tua,Rp299.900,Rp149.900,,
Eglo Up Ii Lampu Lantai - Hitam,Rp299.900,Rp249.000,,
Eglo Up-ii Lampu Lantai - Putih,Rp299.900,Rp249.000,,
Soleil Kursi Lipat Padded - Abu-abu,Rp219.900,Rp119.900,,
Soleil Almond Kursi Lipat - Cokelat,Rp249.900,Rp149.900,,
Informa Yaris Kursi Anak - Merah,Rp159.000,Rp115.000,,
Soleil Bangku Metal - Putih,Rp109.900,Rp79.900,,
Sunon Shield Kursi Kantor Sandaran Rendah - Hitam,Rp1.999.000,Rp1.099.000,,
Informa Yaris Kursi Anak - Hijau,Rp159.000,Rp115.000,,
Informa Torry Kursi Makan Bayi - Putih,Rp329.000,Rp245.000,,
Krisbow Set Meja & Bangku Bench Lipat - Putih,Rp1.199.000,Rp799.900,,
Soleil Kursi Recliner Lipat - Cokelat,Rp649.900,Rp499.900,,
Odi Meja Lipat Laptop Dengan Tempat Gelas - Pink Muda,Rp99.900,Rp75.000,,
Soleil Almond Kursi Lipat - Hitam,Rp249.900,Rp149.900,,
Krisbow Olympic Kursi Lipat - Putih,Rp249.900,Rp199.900,,
Stora Rak Plastik 4 Tingkat - Putih,Rp199.900,Rp149.900,,
Informa Yaris Kursi Anak - Kuning,Rp159.000,Rp115.000,,
Stora Rak Sepatu Stackable 2 Tingkat - Hitam,Rp138.900,,,
Ace 22 Cm Bangku Pijak Lipat - Merah,Rp99.900,Rp69.000,,
Informa Heize Meja Kantor - Putih,Rp1.599.000,Rp699.000,,
Soleil Meja Teras Dengan Tray - Merah Scarlet,Rp299.000,Rp129.900,,
Soleil Lucio Bistro Set Kursi & Meja Teras Lipat - Hitam,Rp1.599.000,Rp799.500,,
Soleil 60 Cm Meja Teras - Cokelat Tua,Rp329.900,Rp296.910,,
Informa Lampu Meja Led Portable - Putih,Rp89.000,Rp49.000,,
Soleil Bangku Pijak - Putih,Rp65.000,,,
Informa Oxy Meja Lipat - Hitam,Rp199.000,Rp169.000,,
Soleil 46 Cm Meja Teras Dengan Tray - Putih,Rp299.000,Rp129.900,,
Informa Oxy Meja Lipat - Biru,Rp199.000,Rp169.000,,
Soleil Kursi Teras Berlengan - Hitam,Rp399.900,Rp199.900,,
Soleil Bangku Pijak Lipat 32 Cm,Rp109.900,Rp85.000,,
Informa Leta Meja Tamu Dengan Penyimpanan - Hitam,Rp799.000,Rp449.000,,
Product Name,Original Price,Discounted Price,Rating,Reviews
Odi Meja Lipat Laptop Dengan Tempat Gelas - Biru Muda,Rp99.900,,,
Stora Rak Plastik 4 Tingkat - Putih,Rp199.900,Rp149.900,,
Informa London Kursi Kantor Sandaran Rendah - Hitam,Rp1.299.000,Rp779.400,,
Soleil Spring Kursi Teras Stripe - Biru Sky,Rp199.900,Rp129.900,,
Informa Clair Lampu Meja Multifungsi - Hitam,Rp299.000,Rp179.000,,
Informa Topaz Meja Tamu Dengan Penyimpanan - Hitam,Rp189.000,Rp99.000,,
Informa Topaz Meja Tamu Dengan Penyimpanan - Putih,Rp189.000,Rp99.000,,
Informa Toby Meja Tamu Dengan Penyimpanan - Hitam,Rp189.000,Rp89.000,,
Informa Topaz Meja Tamu Dengan Penyimpanan - Gold,Rp189.000,Rp99.000,,
Informa Toby Meja Tamu Dengan Penyimpanan - Putih,Rp189.000,Rp89.000,,
Informa Lexi Set Meja Makan Lipat 2 Bangku - Cokelat Walnut,Rp1.299.000,Rp599.000,,
Soleil Kursi Lipat - Hitam,Rp219.900,Rp119.900,,
Informa Neo Dacey Kursi Kafe - Putih,Rp659.000,Rp239.000,,
Informa Colorado Set Kursi & Meja Teras - Cokelat,Rp999.000,Rp649.000,,
Odi Meja Lipat Laptop Dengan Mouse Pad - Hitam,Rp199.000,,,
Krisbow Meja Lipat Adjustable - Putih,Rp399.900,Rp249.900,,
Informa Yaris Kursi Anak - Kuning,Rp159.000,Rp115.000,,
Selma Set Meja Makan Lipat 2 Kursi - Hitam/cokelat Oak,Rp1.299.000,Rp549.000,,
Selma Gwinston Sofa Bed Fabric - Cokelat,Rp1.999.000,Rp1.599.000,,
Stora Rak Sepatu Stackable 2 Tingkat - Hitam,Rp138.900,,,
Ace 22 Cm Bangku Pijak Lipat - Merah,Rp99.900,Rp69.000,,
Selma Cosmo Kursi Kantor Sandaran Rendah - Hitam,Rp1.099.000,Rp649.000,,
Soleil Kursi Lipat Round - Abu-abu Tua,Rp249.900,Rp109.900,,
Informa Zeus Set 5 Pcs Meja Makan Dengan Bangku - Hitam,Rp2.899.000,Rp1.199.000,,
Informa Macaroons Kursi Kantor Sandaran Rendah - Pink,Rp799.000,Rp599.000,,
Informa Macaroons Kursi Kantor Sandaran Rendah - Kuning,Rp799.000,Rp599.000,,
Soleil Bangku Pijak Plastik - Biru,Rp199.000,,,
Informa Beta Kursi Makan - Hitam,Rp599.000,Rp299.000,,
Stora Rak Troli Serbaguna 4 Tingkat - Putih,Rp299.900,Rp239.920,,
Informa Marsha Meja Tamu - Putih,Rp1.299.000,Rp1.199.000,,
Newstorm 122x62 Cm Molding Meja Taman Lipat 44ft - Putih,Rp949.900,Rp854.910,,
Sunon Shield Kursi Kantor Sandaran Rendah - Biru,Rp1.999.000,Rp1.099.000,,
New Storm 76x50 Cm Meja Taman Lipat Adjustable - Putih,Rp449.900,Rp364.419,,
Stora 38x38 Cm Bangku Ottoman Lipat Brick - Oranye,Rp179.900,,,
Stora Rak Sepatu 4 Tingkat Dengan Tempat Payung,Rp249.900,Rp174.930,,
Selma Tiffany Meja Tamu Dengan Penyimpanan - Gold,Rp199.000,Rp109.000,,
Soleil Ramadante Sofa Bed Kulit Outdoor - Hitam,Rp2.399.000,Rp1.199.500,,
Informa Mini Oxy Meja Lipat Dengan Strap - Pink,Rp129.000,Rp99.000,,
Eglare Lampu Tidur Batu Himalayan,Rp99.900,,,
Krisbow Meja Lipat 152 Cm - Putih,Rp899.000,Rp809.100,,
Soleil Kursi Teras Berlengan Textilene- Hitam,Rp319.900,Rp249.900,,
Soleil Bangku Lipat 30 Cm - Cokelat Walnut,Rp129.900,Rp99.900,,
Informa Yaris Meja Anak Square - Merah,Rp599.000,Rp499.000,,
Selma Oliver Meja Lipat Laptop - Cokelat,Rp139.000,Rp109.000,,
Selma Cottie Kursi Kantor Sandaran Rendah - Hitam,Rp799.000,Rp459.000,,
Informa Yaris Meja Anak Rectangle - Hijau,Rp799.000,Rp699.000,,
Soleil Thea Kursi Lipat - Abu-abu Muda,Rp249.900,Rp149.900,,
Informa Heidy Set Meja Makan 2 Kursi - Cokelat,Rp1.299.000,Rp899.000,,
Soleil Set 5 Pcs Bangku & Meja Lipat Serbaguna - Abu-abu,Rp1.199.000,Rp599.500,,
Informa Amatsu Chi Meja Gaming - Hitam,Rp2.199.000,Rp1.499.000,,
Selma Flint Meja Komputer Lipat - Hitam,Rp999.000,Rp499.500,,
Informa Lexy Set Meja Makan 2 Bangku - Cokelat Beech,Rp1.299.000,Rp599.000,,
Informa Aryana Sofa Fabric 2 Seater - Abu-abu,Rp5.000.000,Rp1.699.000,,
Selma Sofa Bed Fabric - Cokelat,Rp2.499.000,Rp949.000,,
Krisbow 122x62 Cm Meja Lipat - Putih,Rp649.000,Rp584.100,,
Informa Rak Troli Penyimpanan 4 Tingkat 38x26x86 Cm,Rp299.000,Rp129.000,,
Informa Lomo Kursi Kantor Sandaran Rendah - Hitam,Rp1.099.000,Rp659.400,,
Soleil Kursi Teras Rotan - Hitam,Rp299.900,Rp149.900,,
Soleil Meja Teras Dengan Tray - Hitam,Rp299.000,Rp129.900,,
Informa Neo Helios Meja Sisi - Hitam,Rp299.000,Rp139.000,,
Selma Sofa Bed Fabric - Abu-abu,Rp2.499.000,Rp949.000,,
Soleil Meja Teras Sisi 45 Cm - Hitam,Rp249.900,Rp224.910,,
Informa Geneva Sofa Bed Fabric - Cokelat,Rp2.799.000,Rp1.499.000,,
Soleil Bangku Metal - Hitam,Rp109.900,Rp79.900,,
Soleil Kursi Lipat - Putih,Rp219.900,Rp119.900,,
Informa Heize Meja Kantor - Putih,Rp1.599.000,Rp699.000,,
Soleil Wicker Set Kursi & Meja Teras Bistro - Beige,Rp1.099.000,Rp679.000,,
Informa Liverpool Kursi Kantor Sandaran Tinggi - Hitam,Rp1.999.000,,,
Soleil Meja Teras Dengan Tray - Merah Scarlet,Rp299.000,Rp129.900,,
Soleil Lucio Bistro Set Kursi & Meja Teras Lipat - Hitam,Rp1.599.000,Rp799.500,,
Selma Gotham Sofa Bed Kulit - Hitam,Rp2.199.000,Rp1.699.000,,
Selma Laguna Sofa Bed Fabric - Cokelat,Rp7.999.000,Rp3.699.000,,
Informa Wolby Meja Lipat - Cokelat,Rp249.000,Rp145.000,,
Informa Zoe Set Meja Makan 4 Bangku - Cokelat,Rp2.099.000,Rp1.499.000,,
Informa Neo Helios Meja Sisi - Putih,Rp299.000,Rp139.000,,
Informa Lexon Set Meja Makan 4 Kursi - Cokelat Tua,Rp1.999.000,Rp1.199.000,,
Informa Geneva Sofa Bed Fabric - Merah,Rp2.799.000,Rp1.499.000,,
Informa Ziamon Kursi Kantor Sandaran Rendah - Hitam,Rp699.000,Rp489.300,,
Selma Tiffany Meja Tamu Dengan Penyimpanan - Hitam,Rp199.000,Rp109.000,,
Selma Hana Set Meja Makan 2 Kursi - Cokelat,Rp1.299.000,Rp799.000,,
Soleil Kursi Teras Anyaman - Hitam,Rp299.900,Rp199.900,,
Soleil Luna Bangku Metal - Biru,Rp119.900,Rp79.900,,
Informa Yaris Meja Anak Rectangle - Biru,Rp799.000,Rp699.000,,
Informa Lexee Meja Kantor - Cokelat Oak/putih,Rp2.199.000,Rp1.099.000,,
Informa Heidi Meja Kantor - Putih/cokelat Oak,Rp2.199.000,Rp799.000,,
Odi Meja Lipat Laptop - Cokelat Tua,Rp169.000,,,
Stora Rak Sepatu 5 Tingkat - Abu-abu,Rp329.900,Rp263.920,,
Eglo Trondio Lampu Meja E14 - Putih,Rp199.900,Rp129.000,,
Informa Oxy Meja Laptop Lipat - Hijau,Rp199.000,Rp169.000,,
Eglare Lampu Meja Led Rgb Dengan Remote,Rp199.900,Rp129.000,,
Informa Pristine Set Meja Makan 4 Bangku - Cokelat/putih,Rp2.399.000,Rp1.799.000,,
Bilie Meja Kantor - Putih/cokelat Oak,Rp999.000,Rp499.000,,
Informa Darren Bangku Rak Sepatu 3 Tingkat - Putih,Rp849.000,Rp699.000,,
Eglo Basic Lampu Meja - Putih,Rp99.900,,,
Soleil 3x3 Mtr Tenda Gazebo Lipat - Hijau Tua,Rp1.599.000,Rp999.900,,
Informa Milgen Set Meja Makan 4 Kursi - Cokelat Muda,Rp6.495.000,Rp4.999.000,,
Informa Yaris Meja Anak Rectangle - Merah,Rp799.000,Rp699.000,,
Beck Meja Kantor - Hitam,Rp999.000,Rp499.000,,
Informa London Z Kd Kursi - Hitam,Rp599.000,,,
Informa Marsha Meja Sisi - Putih,Rp999.000,Rp749.000,,
Informa Spencer Kursi Kantor Sandaran Sedang - Hitam,Rp1.299.000,Rp899.000,,
Informa Yaris Meja Anak Rectangle - Kuning,Rp799.000,Rp699.000,,
Selma Set 2 Pcs Milan Meja Tamu - Hitam,Rp1.999.000,Rp1.499.000,,
Eglare Set 3 Pcs Cassie Lampu Meja & Lampu Lantai Marble - Brass,Rp1.299.000,Rp599.000,,
Odi Meja Lipat Laptop - Abu-abu Tua,Rp169.000,,,
Ashley Ludden Sofa Recliner Fabric 1 Seater - Abu-abu,Rp8.499.000,Rp4.149.000,,
Krisbow Meja Lipat Rotan - Hitam,Rp949.900,Rp769.419,,
Informa Louise Sofa Sudut Fabric - Cokelat Tua,Rp7.499.000,Rp4.499.000,,
Soleil Almond Bangku Dengan Roda - Hitam,Rp99.900,Rp69.900,,
Eglare Lampu Meja Mini - Hijau,Rp69.900,,,
Informa Daphnie Oakland Sofa Bed Fabric - Cokelat,Rp1.799.000,Rp999.000,,
Soleil Spring Kursi Teras Rainbow Stripe,Rp199.900,Rp129.900,,
Informa Yaris Kursi Anak - Biru Tua,Rp159.000,Rp115.000,,
Informa Zaki Kursi Kantor Sandaran Rendah - Hitam,Rp799.000,Rp499.000,,
Soleil 60 Cm Meja Teras Round - Hitam,Rp329.900,Rp296.910,,
Soleil Kursi Teras Rotan - Cokelat Tua,Rp299.900,Rp149.900,,
Eglo Up Ii Lampu Lantai - Hitam,Rp299.900,Rp249.000,,
Selma Tango Bangku - Abu-abu Muda,Rp199.000,Rp179.000,,
Informa Hazel Meja Kantor - Hitam,Rp2.499.000,Rp999.600,,
Eglo Up-ii Lampu Lantai - Putih,Rp299.900,Rp249.000,,
Soleil Kursi Lipat Padded - Abu-abu,Rp219.900,Rp119.900,,
Selma Greesa Sofa Bed Kulit - Hitam,Rp3.199.000,Rp2.799.000,,
Informa Geneva Sofa Bed Fabric - Biru,Rp2.799.000,Rp1.499.000,,
Soleil Almond Kursi Lipat - Cokelat,Rp249.900,Rp149.900,,
Soleil 60 Cm Meja Teras - Cokelat Tua,Rp329.900,Rp296.910,,
Ashley Brise Sofa L Sectional Fabric - Abu-abu,Rp13.299.000,Rp7.699.000,,
Informa Lampu Meja Led Portable - Putih,Rp89.000,Rp49.000,,
Soleil Bangku Pijak - Putih,Rp65.000,,,
Informa Oxy Meja Lipat - Hitam,Rp199.000,Rp169.000,,
Soleil 46 Cm Meja Teras Dengan Tray - Putih,Rp299.000,Rp129.900,,
Selma Eris Meja Kantor Eris 120 - Putih,Rp1.399.000,Rp799.000,,
Informa Oxy Meja Lipat - Biru,Rp199.000,Rp169.000,,
Soleil Kursi Teras Berlengan - Hitam,Rp399.900,Rp199.900,,
Soleil Bangku Pijak Lipat 32 Cm,Rp109.900,Rp85.000,,
Informa Leta Meja Tamu Dengan Penyimpanan - Hitam,Rp799.000,Rp449.000,,
Stora Troli Rak Serbaguna 4 Tingkat - Putih,Rp239.900,Rp167.930,,
Selma Oliver Meja Laptop Dengan Strap - Hitam,Rp139.000,Rp109.000,,
Selma Look Set Meja Makan 4 Kursi - Cokelat,Rp2.199.000,Rp1.099.500,,
Informa Taro Meja Belajar Anak - Putih,Rp379.000,Rp299.000,,
Informa Wilshire Bangku - Hijau Khaki,Rp1.199.000,Rp499.000,,
Informa Leta Meja Tamu Dengan Penyimpanan - Putih,Rp799.000,Rp449.000,,
Soleil Steelix Kursi Teras Berlengan - Cokelat,Rp399.900,Rp199.900,,
Soleil Canterbury Kursi Taman - Hitam,Rp1.299.000,Rp1.039.200,,
Krisbow Meja Lipat Rotan 122 Cm - Hitam,Rp649.900,Rp526.419,,
Cheers Milford Sofa Recliner Fabric 1 Seater - Cokelat,Rp7.799.000,Rp3.899.500,,
Informa Gallant Meja Kantor - Putih,Rp1.999.000,Rp1.399.000,,
Informa Set 4 Pcs Elodia Meja Makan & Kursi - Cokelat Beech,Rp4.999.000,Rp3.499.000,,
Soleil Acapulco Set Meja & Kursi Teras - Cokelat,Rp2.199.900,Rp1.099.950,,
Eglare Lampu Tidur Rechargeable Rabbit,Rp99.900,,,
Odi Meja Lipat Laptop Dengan Tempat Gelas - Hijau Muda,Rp99.900,Rp75.000,,
Ataru Lampu Gantung Hias - Abu-abu,Rp79.900,Rp29.900,,
Eglo Up-ii Lampu Lantai - Nickle,Rp349.900,Rp299.000,,
New Storm Meja Taman Lipat Adjustable - Putih,Rp1.199.000,Rp1.079.100,,
Odi Meja Lipat Laptop Dengan Mouse Pad - Hitam,Rp199.000,,,
Informa Haris Kursi Banquet - Hitam,Rp259.000,,,
Soleil 3x3 Mtr Tenda Gazebo Lipat - Biru Tua,Rp1.599.000,Rp999.900,,
Soleil Ramadante Sofa Bed Kulit Outdoor - Cokelat Tua,Rp2.399.000,Rp1.199.500,,
Selma Cooper Kursi Kantor Sandaran Rendah - Hijau/hitam,Rp1.399.000,Rp529.000,,
Soleil Thea Bangku Lipat - Abu-abu Muda,Rp149.900,Rp79.900,,
Informa Stego Bangku Pijak - Abu-abu,Rp170.000,,,
Informa Daphnie Oakland Sofa Bed Fabric - Biru,Rp1.799.000,Rp999.000,,
Informa Neo Helios Meja Sisi - Biru Muda,Rp299.000,Rp139.000,,
Selma Geni Sofa Bed Kulit Dengan Console A5 - Cokelat,Rp2.599.000,Rp1.999.000,,
Informa Zeppelin Kursi Kantor Sandaran Rendah - Hitam,Rp949.000,,,
Informa Uzziel Kursi Kantor Sandaran Sedang - Hitam,Rp1.499.000,Rp1.199.000,,
Informa Yaris Meja Anak Square - Biru,Rp599.000,Rp499.000,,
Selma Minka Set Meja Makan 4 Kursi - Hitam,Rp2.995.000,Rp1.899.000,,
Informa Farro Meja Kantor Adjustable - Cokelat,Rp1.599.000,Rp799.500,,
Informa Yelets Set Meja Makan 4 Kursi - Putih/cokelat,Rp6.195.000,Rp4.999.000,,
Informa Harmon Kursi - Hitam,Rp399.000,Rp279.000,,
Informa Yaris Kursi Anak - Merah,Rp159.000,Rp115.000,,
Soleil Bangku Metal - Putih,Rp109.900,Rp79.900,,
Sunon Shield Kursi Kantor Sandaran Rendah - Hitam,Rp1.999.000,Rp1.099.000,,
Informa Yaris Kursi Anak - Hijau,Rp159.000,Rp115.000,,
Informa Torry Kursi Makan Bayi - Putih,Rp329.000,Rp245.000,,
Krisbow Set Meja & Bangku Bench Lipat - Putih,Rp1.199.000,Rp799.900,,
Soleil Kursi Recliner Lipat - Cokelat,Rp649.900,Rp499.900,,
Odi Meja Lipat Laptop Dengan Tempat Gelas - Pink Muda,Rp99.900,Rp75.000,,
Soleil Almond Kursi Lipat - Hitam,Rp249.900,Rp149.900,,
Informa Umura Kursi Kantor Sandaran Tinggi - Hitam,Rp2.499.000,Rp1.799.000,,
Krisbow Olympic Kursi Lipat - Putih,Rp249.900,Rp199.900,,
Selma Tiffany Meja Tamu Dengan Penyimpanan - Putih,Rp199.000,Rp109.000,,
Soleil 67x82.5x87.8 Cm Butterfly Kursi Lipat - Abu-abu Tua,Rp399.900,,,
Soleil Meja Teras Sisi 51 Cm - Hitam,Rp269.900,Rp242.910,,
Odi Meja Lipat Laptop Dengan Tempat Gelas - Kuning Muda,Rp99.900,Rp75.000,,
Informa Neo Dacey Kursi Kafe - Hitam,Rp659.000,Rp239.000,,
Krisbow Meja Lipat 122 Cm - Hijau,Rp649.000,Rp584.100,,
Krisbow Meja Lipat Personal - Putih,Rp219.900,Rp178.119,,
Soleil Kursi Recliner Zero Gravity Dengan Bantal - Biru,Rp899.900,Rp699.900,,
Stora 38x38 Cm Bangku Ottoman Lipat Brick - Hijau,Rp179.900,,,
Informa Yericho Set Meja Makan 4 Kursi - Cokelat Muda,Rp2.999.000,Rp2.299.000,,
Informa Daphnie Oakland Sofa Bed Fabric - Abu-abu Tua,Rp1.799.000,Rp999.000,,
Soleil Luna Bangku Metal - Hitam,Rp119.900,Rp79.900,,
Stora Troli Serbaguna 4 Tingkat - Putih,Rp179.900,Rp143.920,,
Informa Roes Kursi Kantor Sandaran Tinggi 161 - Hitam,Rp2.199.000,Rp1.499.000,,
Berka 120 Cm Meja Kantor - Putih,Rp679.000,Rp599.000,,
Soleil 45 Cm Bangku Lipat Telescopic Random,Rp199.900,Rp99.900,,
Ataru Lampu Gantung Hias - Cokelat Tua,Rp79.900,Rp29.900,,
Informa Hove Bangku - Cokelat Tua,Rp99.000,Rp79.000,,
Soleil Thea Meja Teras Dengan Tray - Hitam,Rp349.900,Rp109.900,,
Soleil Kursi Ayun 2 Seater Stripe - Biru/putih,Rp1.499.000,Rp899.900,,
Eglare Icolor Lampu Meja Led Eco 8w - Hitam,Rp279.900,Rp199.000,,
Soleil Estelle Meja Sisi Small - Hitam,Rp349.900,Rp299.900,,
Informa Neo Mocha Kursi Bar H65 - Cokelat Tua,Rp549.000,Rp429.000,,
Informa Milgen Kursi Makan - Cokelat Muda,Rp999.000,Rp699.000,,
Informa Torry Kursi Makan Bayi - Biru,Rp329.000,Rp245.000,,
Selma Set 2 Pcs Porto Meja Tamu - Cokelat Oak,Rp1.499.000,Rp859.000,,
Informa Neo Titans Bangku - Hitam,Rp179.000,,,
Informa Gio Meja Belajar - Putih,Rp1.599.000,Rp849.000,,
Soleil Meja Teras 51 Cm - Cokelat Tua,Rp269.900,Rp242.910,,
Krisbow Tiang Antrian Stainless Steel Tdengan Tali - Biru,Rp599.900,,,
Krisbow Lampu Taman Double 6w 6500k Cool Daylight,Rp179.900,Rp89.950,,
Selma Gwinston Sofa Bed Fabric- Merah,Rp1.999.000,Rp1.599.000,,
Apa Cappy Lampu Meja Led Rechargeable Dimmable - Putih,Rp249.900,Rp159.000,,
Paso Kursi Anak Fy20406 - Ungu,Rp159.000,Rp115.000,,
Soleil 2x2 Mtr Tenda Gazebo Lipat - Biru,Rp1.299.000,Rp799.900,,
Soleil 2.5 Mtr Patio Payung Taman - Hijau Tua,Rp799.900,Rp639.900,,
Informa Gordon Meja Kantor - Putih,Rp2.799.000,Rp1.499.000,,
Selma Morell Kursi Kantor Sandaran Rendah - Abu-abu,Rp959.000,Rp499.000,,
Informa Macaroons Kursi Kantor Sandaran Rendah - Biru,Rp799.000,Rp599.000,,
Informa Zeus Set Meja Makan 4 Bangku - Putih,Rp2.899.000,Rp1.199.000,,
Soleil Kursi Banquet Susun - Hitam,Rp299.900,Rp269.910,,
Soleil Meja Teras Tray - Cokelat Tan,Rp299.900,Rp129.900,,
Soleil Truro Meja Teras 70 Cm - Hitam,Rp879.900,Rp703.920,,
Informa Dan Bangku Bar - Hitam,Rp649.000,Rp499.000,,
Soleil Bangku Pijak Plastik - Abu-abu,Rp199.000,,,
Selma Moris Kursi Kantor Sandaran Rendah - Abu-abu/hitam,Rp799.000,Rp499.000,,
Selma Set 2 Pcs Porto Meja Tamu Marble - Hitam,Rp1.499.000,Rp859.000,,
Soleil Bangku Metal Padded - Hitam,Rp129.900,Rp99.900,,
Informa Hexa Meja Kantor - Cokelat,Rp1.799.000,Rp1.099.000,,
Soleil Ramadante Sofa Bed Kulit Outdoor - Putih Ivory,Rp2.399.000,Rp1.199.500,,
Informa Garland Sofa Bed Fabric - Hijau,Rp3.499.000,Rp2.699.000,,
Selma Landra Kursi Lipat - Hitam,Rp239.000,Rp139.000,,
Selma Malden Kursi Kantor Sandaran Tinggi - Hitam,Rp1.599.000,Rp999.000,,
Soleil Bangku Metal - Biru Navy,Rp109.900,Rp79.900,,
Selma Gwinston Sofa Bed Fabric - Ungu,Rp1.999.000,Rp1.499.000,,
Informa Meja Tamu Martian - Abu-abu,Rp1.199.000,Rp999.000,,
Informa Albris Sofa Sudut Fabric - Abu-abu,Rp5.499.000,Rp4.899.000,,
Informa Geneva Sofa Bed Fabric - Kuning,Rp2.799.000,Rp1.499.000,,
Selma Hero Meja Lipat Laptop - Hitam,Rp699.000,Rp329.000,,
Informa Harmon Kursi - Putih,Rp399.000,Rp279.000,,
Informa Kentucky Bangku Bar - Hitam,Rp759.000,Rp699.000,,
Soleil Hinata Kursi Teras - Putih Ivory,Rp399.900,Rp249.900,,
Informa Martis Oakland Sofa Bed Fabric - Abu-abu,Rp1.999.000,Rp1.199.000,,
Soleil 22 Ltr Alas Payung Tenda,Rp349.900,,,
Selma Gwinston Sofa Bed Fabric - Hijau,Rp1.999.000,Rp1.399.000,,
Stora Rak Troli Multifungsi 3 Tingkat - Putih,Rp199.900,Rp139.930,,
Soleil 2x2 Mtr Tenda Gazebo Lipat - Hijau,Rp1.299.000,Rp799.900,,
Informa Meja Kantor Metal 100x36x74 Cm - Putih,Rp1.199.000,Rp599.000,,
Ashley Ludden Sofa Recliner Fabric 1 Seater - Cokelat,Rp8.499.000,Rp4.149.000,,
